{
  "schema_version": "1",
  "run_id": "ejemplo-01",
  "sequence_id": "S02",
  "frame_id": "S02_f0004",
  "t_capture_ms": 600,
  "t_emit_ms": 604.8,
  "image_width": null,
  "image_height": null,
  "model_sha256": "aaaaaaaaaaaaaaaaaaaaaaaaaaaaaaaaaaaaaaaaaaaaaaaaaaaaaaaaaaaaaaaa",
  "config_sha256": "bbbbbbbbbbbbbbbbbbbbbbbbbbbbbbbbbbbbbbbbbbbbbbbbbbbbbbbbbbbbbbbb",
  "status": "error",
  "bbox_format": "xyxy",
  "bbox_unit": "px",
  "detections": [],
  "error": {
    "code": "unreadable_image",
    "message": "No se pudo decodificar el cuadro (JPEG truncado)."
  }
}
