{
  "schema_version": "1",
  "run_id": "ejemplo-01",
  "sequence_id": "S01",
  "frame_id": "S01_f0001",
  "t_capture_ms": 0,
  "t_emit_ms": 41.2,
  "image_width": 640,
  "image_height": 480,
  "model_sha256": "aaaaaaaaaaaaaaaaaaaaaaaaaaaaaaaaaaaaaaaaaaaaaaaaaaaaaaaaaaaaaaaa",
  "config_sha256": "bbbbbbbbbbbbbbbbbbbbbbbbbbbbbbbbbbbbbbbbbbbbbbbbbbbbbbbbbbbbbbbb",
  "status": "ok",
  "bbox_format": "xyxy",
  "bbox_unit": "px",
  "detections": []
}
